{
  "contractVersion": "geometry-contract-v1",
  "description": "Benchmark v2 single-source admitted geometry; identity remains null.",
  "instances": [
    {
      "bbox": [
        8,
        103,
        98,
        162
      ],
      "bboxCoordinateSpace": "source_pixel",
      "canonicalItemId": null,
      "contentVerification": {
        "contentVerified": true,
        "evidenceType": "manual_review",
        "note": "Source review resolves the lower split child to a separate physical parent bbox; geometry only, with no semantic or quality assertion.",
        "reviewStatus": "reviewed_consistent",
        "scope": "crop_instance_binding_only"
      },
      "footprint": null,
      "instanceId": "inst-a531a2be8c36eca7279a",
      "observationLabel": null,
      "sourceId": "src-c86e85c5712aea00ac7d"
    }
  ],
  "pathBase": "repository_root",
  "queueSlots": [
    {
      "cropPath": "experiments/vision_benchmark_v2/split_child_slices/lower/crops/crop-a531a2be8c36eca7279a.png",
      "instanceId": "inst-a531a2be8c36eca7279a",
      "queueId": "queue-a531a2be8c36eca7279a"
    }
  ],
  "sources": [
    {
      "coordinateSpace": "source_pixel",
      "height": 329,
      "inventoryEligible": true,
      "inventoryRoi": {
        "coordinateSpace": "source_pixel",
        "height": 329,
        "width": 307,
        "x": 0,
        "y": 0
      },
      "sceneType": "inventory_crop",
      "sourceId": "src-c86e85c5712aea00ac7d",
      "sourcePath": "experiments/vision_benchmark_v2/split_child_slices/lower/snapshots/source-c86e85c5712aea00ac7d.png",
      "width": 307
    }
  ]
}
